{
  "schema_version": "1.0",
  "portfolio": {
    "portfolio_id": "portfolio_all_types_001",
    "name": "Synthetic All Types Portfolio",
    "base_currency": "USD",
    "created_at": "2026-08-01T12:00:00Z"
  },
  "rules": {
    "machine_rules": [
      {
        "rule_id": "rule_all_001",
        "type": "max_contribution_per_period",
        "enabled": true,
        "created_at": "2026-08-01T12:00:00Z",
        "config": {
          "amount": "25.00",
          "period": "month"
        }
      },
      {
        "rule_id": "rule_all_002",
        "type": "minimum_days_between_contributions",
        "enabled": true,
        "created_at": "2026-08-01T12:00:00Z",
        "config": {
          "days": 7
        }
      },
      {
        "rule_id": "rule_all_003",
        "type": "portfolio_value_review_threshold",
        "enabled": true,
        "created_at": "2026-08-01T12:00:00Z",
        "config": {
          "threshold_value": "100.00",
          "direction": "at_or_above"
        }
      },
      {
        "rule_id": "rule_all_004",
        "type": "milestone_review",
        "enabled": true,
        "created_at": "2026-08-01T12:00:00Z",
        "config": {
          "milestone_id": "milestone_all_001"
        }
      },
      {
        "rule_id": "rule_all_005",
        "type": "scheduled_review_date",
        "enabled": true,
        "created_at": "2026-08-01T12:00:00Z",
        "config": {
          "review_date": "2026-09-01"
        }
      }
    ],
    "guidance_notes": [
      {
        "note_id": "guidance_all_001",
        "text": "Synthetic guidance note for contract coverage.",
        "created_at": "2026-08-01T12:00:00Z"
      }
    ]
  },
  "milestones": [
    {
      "milestone_id": "milestone_all_001",
      "label": "Synthetic checkpoint",
      "target_value": "100.00",
      "created_at": "2026-08-01T12:00:00Z",
      "reached_at": "2026-08-08T12:00:00Z"
    }
  ],
  "ledger": [
    {
      "event_id": "event_all_001",
      "event_type": "contribution",
      "occurred_at": "2026-08-01T13:00:00Z",
      "recorded_at": "2026-08-01T13:01:00Z",
      "source": "guided",
      "data": {
        "amount": "20.00",
        "currency": "USD"
      }
    },
    {
      "event_id": "event_all_002",
      "event_type": "withdrawal",
      "occurred_at": "2026-08-02T13:00:00Z",
      "recorded_at": "2026-08-02T13:01:00Z",
      "source": "guided",
      "data": {
        "amount": "2.00",
        "currency": "USD"
      }
    },
    {
      "event_id": "event_all_003",
      "event_type": "trade",
      "occurred_at": "2026-08-03T13:00:00Z",
      "recorded_at": "2026-08-03T13:01:00Z",
      "source": "guided",
      "data": {
        "from_asset": "USD",
        "to_asset": "BTC",
        "from_quantity": "5.00",
        "to_quantity": "0.000040"
      }
    },
    {
      "event_id": "event_all_004",
      "event_type": "fee",
      "occurred_at": "2026-08-03T13:00:00Z",
      "recorded_at": "2026-08-03T13:01:00Z",
      "source": "guided",
      "data": {
        "amount": "0.10",
        "currency": "USD",
        "asset_symbol": "BTC"
      }
    },
    {
      "event_id": "event_all_005",
      "event_type": "reward",
      "occurred_at": "2026-08-04T13:00:00Z",
      "recorded_at": "2026-08-04T13:01:00Z",
      "source": "guided",
      "data": {
        "reward_type": "staking",
        "amount": "0.05",
        "currency": "USD",
        "asset_symbol": "ETH"
      }
    },
    {
      "event_id": "event_all_006",
      "event_type": "note",
      "occurred_at": "2026-08-05T13:00:00Z",
      "recorded_at": "2026-08-05T13:01:00Z",
      "source": "guided",
      "data": {
        "text": "Synthetic note that will be voided by the next event."
      }
    },
    {
      "event_id": "event_all_007",
      "event_type": "correction",
      "occurred_at": "2026-08-06T13:00:00Z",
      "recorded_at": "2026-08-06T13:01:00Z",
      "source": "guided",
      "data": {
        "target_event_id": "event_all_006",
        "action": "void",
        "reason": "Synthetic valid correction coverage."
      }
    }
  ],
  "snapshots": [
    {
      "snapshot_id": "snapshot_all_001",
      "captured_at": "2026-08-09T13:00:00Z",
      "recorded_at": "2026-08-09T13:02:00Z",
      "total_value": "101.25",
      "holdings": [
        {
          "symbol": "BTC",
          "name": "Bitcoin",
          "asset_type": "crypto",
          "quantity": "0.000040",
          "value": "5.25"
        },
        {
          "symbol": "USD",
          "name": "Cash",
          "asset_type": "cash",
          "value": "96.00"
        }
      ],
      "source": "hybrid",
      "confirmation": {
        "confirmed_at": "2026-08-09T13:01:00Z"
      }
    }
  ],
  "metadata": {
    "record_revision": 8,
    "updated_at": "2026-08-09T13:02:00Z"
  }
}
