{
  "schema_version": "1.0",
  "portfolio": {
    "portfolio_id": "portfolio_minimal_001",
    "name": "Minimal Demo Portfolio",
    "base_currency": "USD",
    "created_at": "2026-08-09T18:00:00Z"
  },
  "rules": {
    "machine_rules": [],
    "guidance_notes": []
  },
  "milestones": [],
  "ledger": [],
  "snapshots": [],
  "metadata": {
    "record_revision": 1,
    "updated_at": "2026-08-09T18:00:00Z"
  }
}
